{
  "schemaVersion": 2,
  "purpose": "BOOTSTRAP",
  "exportId": "11111111-1111-4111-8111-111111111111",
  "sessionId": "22222222-2222-4222-8222-222222222222",
  "worklineId": "00000000-0000-4000-8000-000000000003",
  "taskId": null,
  "attemptId": null,
  "runnerEpoch": 1,
  "throughSequence": 0,
  "baseCommit": "aaaaaaaaaaaaaaaaaaaaaaaaaaaaaaaaaaaaaaaa",
  "expectedPublishedHead": "aaaaaaaaaaaaaaaaaaaaaaaaaaaaaaaaaaaaaaaa",
  "executionOutcome": "NOT_APPLICABLE",
  "treeDigest": "aaaaaaaaaaaaaaaaaaaaaaaaaaaaaaaaaaaaaaaaaaaaaaaaaaaaaaaaaaaaaaaa",
  "stateDigest": "bbbbbbbbbbbbbbbbbbbbbbbbbbbbbbbbbbbbbbbbbbbbbbbbbbbbbbbbbbbbbbbb",
  "runtimeConfigDigest": "025ae4e1a047e924acf89630f631a60ac52b2ac4fcfbda0ddc8b9006e4b7e879",
  "workerImage": "gitnova-agent:fixture-only",
  "entries": []
}
